{
  "schema_version": 1,
  "revision_id": "11111111-1111-4111-8111-111111111111",
  "project_id": "22222222-2222-4222-8222-222222222222",
  "workspace_id": "33333333-3333-4333-8333-333333333333",
  "parent_revision_ids": [],
  "manifest_sha256": "sha256:bbbbbbbbbbbbbbbbbbbbbbbbbbbbbbbbbbbbbbbbbbbbbbbbbbbbbbbbbbbbbbbb",
  "content_sha256": "sha256:cccccccccccccccccccccccccccccccccccccccccccccccccccccccccccccccc",
  "objects": [
    {
      "schema_version": 1,
      "object_id": "sha256:aaaaaaaaaaaaaaaaaaaaaaaaaaaaaaaaaaaaaaaaaaaaaaaaaaaaaaaaaaaaaaaa",
      "sha256": "sha256:aaaaaaaaaaaaaaaaaaaaaaaaaaaaaaaaaaaaaaaaaaaaaaaaaaaaaaaaaaaaaaaa",
      "size_bytes": 1048576,
      "media_type": "application/pdf",
      "logical_path": "materials/course-slides.pdf",
      "display_name": "course-slides.pdf",
      "scan_status": "clean"
    }
  ],
  "created_at": "2026-08-11T08:00:00Z",
  "created_by": "44444444-4444-4444-8444-444444444444",
  "message": "Synthetic genesis revision"
}
